{
  "schema": "delib-process/v1",
  "updatedAt": "2026-09-06",
  "promise": "Every round shows where people move, where data moves, who can decide, and how feedback changes the next round.",
  "steps": [
    {
      "id": "frame",
      "number": "01",
      "icon": "target",
      "title": "定義問題",
      "humanFlow": "主辦者＋受影響社群",
      "dataFlow": "問題、權限、同意、風險",
      "tools": [
        "Pocket Form",
        "Pocket Values"
      ],
      "detail": "公開議題 brief，開放改寫問題。 與受影響的人走訪現場，確認誰有決定權。",
      "gate": "誰能決定？哪些事真的可以改變？",
      "output": "可修改的議題 brief ＋ 回覆承諾"
    },
    {
      "id": "recruit",
      "number": "02",
      "icon": "megaphone",
      "title": "招募與接觸",
      "humanFlow": "母體 → 受邀者／自願者",
      "dataFlow": "招募條件、聯絡名單、可近用需求",
      "tools": [
        "Pocket Form",
        "Pocket Harmonica"
      ],
      "detail": "表單收集參與意願與可近用需求，聯絡資訊分開保存。 電話、街訪、照顧與交通支持，讓未上線的人能加入。",
      "gate": "哪些人因設備、時間、語言而進不來？",
      "output": "志願者池 ＋ 缺席聲音清單"
    },
    {
      "id": "sortition",
      "number": "03",
      "icon": "shuffle",
      "title": "抽樣與組成",
      "humanFlow": "志願者池 → 正選＋候補",
      "dataFlow": "配額、亂數／演算法、確認與替補紀錄",
      "tools": [
        "Pocket Form",
        "OpenDLP",
        "Panelot",
        "人工覆核"
      ],
      "detail": "需要小型代表性小組時，公開配額與抽樣方法。 確認出席、候補與支持需求；也可採開放參與。",
      "gate": "自願報名不等於代表性抽樣。這一輪需要抽樣嗎？",
      "output": "正選／候補 ＋ 抽樣限制"
    },
    {
      "id": "learn",
      "number": "04",
      "icon": "book-open-check",
      "title": "共同學習",
      "humanFlow": "參與者 ↔ 專家／利害關係人",
      "dataFlow": "證據包、問題池、來源、更正紀錄",
      "tools": [
        "Call-in",
        "Pocket Check",
        "Pocket Testimony"
      ],
      "detail": "分享有來源的資料、理解檢核與可補充的問題池。 平衡資訊說明、專家問答與小組討論，讓參與者能更正。",
      "gate": "大家理解的是同一件事嗎？資料能不能查證？",
      "output": "證據包 ＋ 問題與更正紀錄"
    },
    {
      "id": "listen",
      "number": "05",
      "icon": "messages-square",
      "title": "聽見經驗",
      "humanFlow": "參與者 → 彼此可見的聲音池",
      "dataFlow": "陳述、問卷、訪談與逐筆回應",
      "tools": [
        "Pocket Harmonica",
        "Pocket Form",
        "Pocket Polis",
        "Pocket Values"
      ],
      "detail": "用訪談與陳述投票收集經驗，允許補充、略過與撤回。 小圈聆聽、均等發言，經同意再將逐字內容帶到線上。",
      "gate": "原話是否被正確理解？少數聲音是否仍看得見？",
      "output": "有來源的原話 ＋ 陳述池"
    },
    {
      "id": "deliberate",
      "number": "06",
      "icon": "scale",
      "title": "比較與審議",
      "humanFlow": "小組 ↔ 全體；少數聲音 ↔ 多數方向",
      "dataFlow": "比較、投票、分群、理由與涵蓋率",
      "tools": [
        "Pocket Polis",
        "Pocket Proposals",
        "Pocket Argument",
        "Power Ranker",
        "Pocket Budget"
      ],
      "detail": "找跨群接受的陳述、修訂提案、比較理由與預算取捨。 小組交換理由、提問與修案；保留尚未化解的分歧。",
      "gate": "高分代表什麼？誰沒投票？少數意見去了哪裡？",
      "output": "可推進方案 ＋ 歧見與方法限制"
    },
    {
      "id": "respond",
      "number": "07",
      "icon": "clipboard-check",
      "title": "決定與回覆",
      "humanFlow": "主持者 → 有權回應者 → 參與者",
      "dataFlow": "工具彙整＋人工解讀＋採納狀態",
      "tools": [
        "Pocket TTTC",
        "Pocket Reply",
        "Pocket Testimony"
      ],
      "detail": "逐項連回原話，分開整理、人工解讀與正式回應。 請有權回應者說明採納理由、負責者與期限。",
      "gate": "每個問題都有回覆嗎？沒採納也有理由嗎？",
      "output": "有責任人與期限的成果收據"
    },
    {
      "id": "feedback",
      "number": "08",
      "icon": "refresh-cw",
      "title": "回饋與下一輪",
      "humanFlow": "成果 → 參與者／公眾／開發者 → 下一輪",
      "dataFlow": "公開摘要、修正、流程故障；不含逐筆參與資料",
      "tools": [
        "Pocket Reply",
        "Pocket Form",
        "Call-in"
      ],
      "detail": "開放更正、追蹤承諾，帶著來源與版本開始下一輪。 回到社群檢視改變，邀請缺席的人參與下一輪。",
      "gate": "改變了什麼？誰還沒有被聽見？下一次何時回覆？",
      "output": "下一輪 brief ＋ 明確回到哪一步"
    }
  ],
  "feedbackLoops": [
    {
      "audience": "參與者",
      "action": "查核原話與解讀、要求修正、申訴或加入下一輪"
    },
    {
      "audience": "主辦者",
      "action": "調整招募、抽樣、證據、問題與回覆責任"
    },
    {
      "audience": "工具開發者",
      "action": "修正 schema、轉接、部署與放棄點，不接收參與內容"
    }
  ]
}
